{
  "$schema": "./package-integrity.schema.json",
  "schemaVersion": 1,
  "assemblyId": "recursus-m1-source-lock-v1",
  "algorithm": "sha256",
  "packages": [
    {
      "component": "deepseek-dovetail",
      "path": "deepseek-dovetail/deepseek-dovetail-0.1.0.tgz",
      "sha256": "54f5e449421a094544a5be5001ff90d58f4b460b93be26e575a01806f0ac9536",
      "bytes": 66716
    },
    {
      "component": "deepseek-harness",
      "path": "deepseek-harness/dsh/deepseek-ai-dsh-0.1.0-rc.7.tgz",
      "sha256": "51821871ae1cf76311ab54b32e12b84692c5ffd571cf093d462d62423e84cd8a",
      "bytes": 32872
    },
    {
      "component": "deepseek-harness",
      "path": "deepseek-harness/dsh/deepseek-ai-dsh-acp-0.1.0-rc.7.tgz",
      "sha256": "db030cd254e9aa4d4a73d1e26a9531cc3f50e6c353bc7abb6d879a201f6897cd",
      "bytes": 17065
    },
    {
      "component": "deepseek-harness",
      "path": "deepseek-harness/dsh/deepseek-ai-dsh-acp-demo-0.1.0-rc.7.tgz",
      "sha256": "c7151cf2a7c3cbfb348d25ec3acc2a6dcc5ddb49e137d65309d225191699bfba",
      "bytes": 9701
    },
    {
      "component": "deepseek-harness",
      "path": "deepseek-harness/dsh/deepseek-ai-dsh-acp-snapshot-0.1.0-rc.7.tgz",
      "sha256": "a77bc3f14c6432901908139be5ffb266730e6d10ebbdaffb2493ec0d70c321a5",
      "bytes": 49635
    },
    {
      "component": "deepseek-harness",
      "path": "deepseek-harness/dsh/deepseek-ai-dsh-agent-0.1.0-rc.7.tgz",
      "sha256": "6140719f31f4d8f6f9eea99717ad890e9082a36daab1625452f6980e3bac9425",
      "bytes": 46691
    },
    {
      "component": "deepseek-harness",
      "path": "deepseek-harness/dsh/deepseek-ai-dsh-agent-default-model-0.1.0-rc.7.tgz",
      "sha256": "fb1dc8231afd6d92f439ed429e7a169c81047163e63a9150c2fe5929b7a02bb6",
      "bytes": 5555
    },
    {
      "component": "deepseek-harness",
      "path": "deepseek-harness/dsh/deepseek-ai-dsh-agent-instructions-0.1.0-rc.7.tgz",
      "sha256": "dbb04666a39fc8754b0431d5083f71398b01d356c2278d5f2ccb8a40f022d6af",
      "bytes": 32698
    },
    {
      "component": "deepseek-harness",
      "path": "deepseek-harness/dsh/deepseek-ai-dsh-agent-loop-0.1.0-rc.7.tgz",
      "sha256": "6ede0cf53c0466f9b55ffeeeaf516077aa8d12393677b974f6ae6e674f227995",
      "bytes": 35507
    },
    {
      "component": "deepseek-harness",
      "path": "deepseek-harness/dsh/deepseek-ai-dsh-agent-loop-testkit-0.1.0-rc.7.tgz",
      "sha256": "d4a528cb995498a0e11d7658d5803532108c2e5d4636dae228c831195460489c",
      "bytes": 4498
    },
    {
      "component": "deepseek-harness",
      "path": "deepseek-harness/dsh/deepseek-ai-dsh-agent-presets-0.1.0-rc.7.tgz",
      "sha256": "f70f3881b9a2d7e2422bbf606a185a5e6766f499024b54e18e9ad2f3f22219f1",
      "bytes": 75786
    },
    {
      "component": "deepseek-harness",
      "path": "deepseek-harness/dsh/deepseek-ai-dsh-agent-spine-demo-0.1.0-rc.7.tgz",
      "sha256": "d4cf6487d3bbb438b095ab5c393381ea25dd1049bac468771c310a06ca402582",
      "bytes": 12199
    },
    {
      "component": "deepseek-harness",
      "path": "deepseek-harness/dsh/deepseek-ai-dsh-agent-tool-presentation-0.1.0-rc.7.tgz",
      "sha256": "159db1e53de47b2ed8ab072ab599f46f8957b97ee0c79fd01e589a54c28bdae2",
      "bytes": 6206
    },
    {
      "component": "deepseek-harness",
      "path": "deepseek-harness/dsh/deepseek-ai-dsh-anonymous-user-id-0.1.0-rc.7.tgz",
      "sha256": "685c1b3011811b9dfb2f0e6167bafe548009d680fdbc9e852e16e6aba642d801",
      "bytes": 6722
    },
    {
      "component": "deepseek-harness",
      "path": "deepseek-harness/dsh/deepseek-ai-dsh-api-gateway-0.1.0-rc.7.tgz",
      "sha256": "3057ebff65ce6538c989f053785137b9f29e9c0ebea130fb4cc33399147a1469",
      "bytes": 27851
    },
    {
      "component": "deepseek-harness",
      "path": "deepseek-harness/dsh/deepseek-ai-dsh-api-remotes-0.1.0-rc.7.tgz",
      "sha256": "de7e6bb9f41a0ae4d1a9b989ad3cd6ac4d96e82874d78815723ac85cb886cbfa",
      "bytes": 46660
    },
    {
      "component": "deepseek-harness",
      "path": "deepseek-harness/dsh/deepseek-ai-dsh-app-boot-0.1.0-rc.7.tgz",
      "sha256": "bb1bb310473bb04dd567e95d463c42c19ba820ebd1a1dfe8107fdd704c7fdc3f",
      "bytes": 37529
    },
    {
      "component": "deepseek-harness",
      "path": "deepseek-harness/dsh/deepseek-ai-dsh-atomic-write-0.1.0-rc.7.tgz",
      "sha256": "f0d97017644ee244e725139da9f9a8ef1cc91ac2abf35f8b1ccabae8c79f5bfd",
      "bytes": 7046
    },
    {
      "component": "deepseek-harness",
      "path": "deepseek-harness/dsh/deepseek-ai-dsh-attachment-0.1.0-rc.7.tgz",
      "sha256": "4a97c40b9197ffdd75c9ab3355688e711dea19d040cdc56fdeb5038e6bdff85b",
      "bytes": 7430
    },
    {
      "component": "deepseek-harness",
      "path": "deepseek-harness/dsh/deepseek-ai-dsh-attachment-local-0.1.0-rc.7.tgz",
      "sha256": "ea519cbbea5154b22ffbe5a606c926745f987bd3ab72b6d5e1970686592fd28f",
      "bytes": 9329
    },
    {
      "component": "deepseek-harness",
      "path": "deepseek-harness/dsh/deepseek-ai-dsh-base-0.1.0-rc.7.tgz",
      "sha256": "efdafa118e3de0e66b0ab1adb773e1e9dd5edf835d634f242f7fb45bd7a5efa7",
      "bytes": 12040
    },
    {
      "component": "deepseek-harness",
      "path": "deepseek-harness/dsh/deepseek-ai-dsh-bash-local-0.1.0-rc.7.tgz",
      "sha256": "4f6ac996a1cd62e2ce92cd91442f19b6e818d06e56a4a8273b0978aaa16614ec",
      "bytes": 12105
    },
    {
      "component": "deepseek-harness",
      "path": "deepseek-harness/dsh/deepseek-ai-dsh-bash-sandbox-0.1.0-rc.7.tgz",
      "sha256": "8b860b3788d4c3bea330335d117365aeb8bf561136fac21876493477a8948b4b",
      "bytes": 14594
    },
    {
      "component": "deepseek-harness",
      "path": "deepseek-harness/dsh/deepseek-ai-dsh-brand-0.1.0-rc.7.tgz",
      "sha256": "817d2256c8cdf637d8c353f5bfa8f3bdef39ea427626f5f9a3395051bf560781",
      "bytes": 4010
    },
    {
      "component": "deepseek-harness",
      "path": "deepseek-harness/dsh/deepseek-ai-dsh-client-connection-0.1.0-rc.7.tgz",
      "sha256": "28ecbd1648dbeb77c1fa626c0e1bb3721e7bfbae639d187d6f319ff213bde290",
      "bytes": 100854
    },
    {
      "component": "deepseek-harness",
      "path": "deepseek-harness/dsh/deepseek-ai-dsh-client-hmr-0.1.0-rc.7.tgz",
      "sha256": "e2b0e9cf08594d4064331f4e707cdc4c304a8b8114040b89baaf7680add4495b",
      "bytes": 10139
    },
    {
      "component": "deepseek-harness",
      "path": "deepseek-harness/dsh/deepseek-ai-dsh-client-locale-0.1.0-rc.7.tgz",
      "sha256": "7702a93a49a38c0868fe7a5a0ef8b64b1db8f3b3c84eb9795344a88f031d7222",
      "bytes": 21102
    },
    {
      "component": "deepseek-harness",
      "path": "deepseek-harness/dsh/deepseek-ai-dsh-client-modules-0.1.0-rc.7.tgz",
      "sha256": "ac2d4b470653007592cbe31d693fbece5831275415acea12a1e47526ad657649",
      "bytes": 18001
    },
    {
      "component": "deepseek-harness",
      "path": "deepseek-harness/dsh/deepseek-ai-dsh-client-runtime-0.1.0-rc.7.tgz",
      "sha256": "386cf4cda051b5fa4f841c517a6daeddd554b95c89606d92dfce483f05e25915",
      "bytes": 162656
    },
    {
      "component": "deepseek-harness",
      "path": "deepseek-harness/dsh/deepseek-ai-dsh-client-schema-form-0.1.0-rc.7.tgz",
      "sha256": "4252ff20dac5bb2309042a8d224604e94b6d405357c5063c2e780a23148757cf",
      "bytes": 7228
    },
    {
      "component": "deepseek-harness",
      "path": "deepseek-harness/dsh/deepseek-ai-dsh-client-test-runtime-0.1.0-rc.7.tgz",
      "sha256": "abf5b2dbfb3951e709309cc2180792d91d68efbf822580970f5353b2631357ce",
      "bytes": 27173
    },
    {
      "component": "deepseek-harness",
      "path": "deepseek-harness/dsh/deepseek-ai-dsh-client-ui-agent-preset-0.1.0-rc.7.tgz",
      "sha256": "c6645b34570a84095aea7c516b83f6c985bbc55033f2d627327717c013b5fff0",
      "bytes": 38337
    },
    {
      "component": "deepseek-harness",
      "path": "deepseek-harness/dsh/deepseek-ai-dsh-client-ui-attachment-0.1.0-rc.7.tgz",
      "sha256": "fb78edc0ba389ca316d65568fffec5a36c587507d8032ad219eb5e9a486c6abb",
      "bytes": 13955
    },
    {
      "component": "deepseek-harness",
      "path": "deepseek-harness/dsh/deepseek-ai-dsh-client-ui-commands-0.1.0-rc.7.tgz",
      "sha256": "1a962160468b9ebbcb2af1f91dddbaa74aeb2aedd8da5b629b07e1141514df30",
      "bytes": 27227
    },
    {
      "component": "deepseek-harness",
      "path": "deepseek-harness/dsh/deepseek-ai-dsh-client-ui-conversation-0.1.0-rc.7.tgz",
      "sha256": "5d38440b8d355e3cbdb631fad990a4d1bc4c4ccaa1f68c1b11b7984887cffadf",
      "bytes": 174718
    },
    {
      "component": "deepseek-harness",
      "path": "deepseek-harness/dsh/deepseek-ai-dsh-client-ui-cordis-0.1.0-rc.7.tgz",
      "sha256": "b00f70221a69c3302510ed9b51d587bf5483ee76643bf8e424b819d2e4c08b27",
      "bytes": 31703
    },
    {
      "component": "deepseek-harness",
      "path": "deepseek-harness/dsh/deepseek-ai-dsh-client-ui-deliverables-0.1.0-rc.7.tgz",
      "sha256": "70464dd2a33a98385d7846dc1f775482120ca3ccec7428e20f44dd5577e90657",
      "bytes": 15335
    },
    {
      "component": "deepseek-harness",
      "path": "deepseek-harness/dsh/deepseek-ai-dsh-client-ui-directory-picker-browse-0.1.0-rc.7.tgz",
      "sha256": "4ead2ac3cbbf29ff8c78ca2bddef164b9359dcdeb22ab633da343fb2a51341aa",
      "bytes": 19948
    },
    {
      "component": "deepseek-harness",
      "path": "deepseek-harness/dsh/deepseek-ai-dsh-client-ui-directory-picker-native-0.1.0-rc.7.tgz",
      "sha256": "913186c270ae7355e639baac66af3ff3c13bb3eaaceec0e2e82128f398285ec5",
      "bytes": 6571
    },
    {
      "component": "deepseek-harness",
      "path": "deepseek-harness/dsh/deepseek-ai-dsh-client-ui-goal-0.1.0-rc.7.tgz",
      "sha256": "81af6dd91fac95ade44db92e066ef332806163284e9e5c9efd9d13ed4271c098",
      "bytes": 12134
    },
    {
      "component": "deepseek-harness",
      "path": "deepseek-harness/dsh/deepseek-ai-dsh-client-ui-input-trigger-0.1.0-rc.7.tgz",